{
  "version": 1,
  "name": "聚宽 B 版 62 ETF 动量现金防守（日线口径对照）",
  "universe": [
    "518880",
    "161226",
    "501018",
    "159985",
    "513520",
    "513100",
    "513300",
    "513400",
    "159529",
    "513030",
    "159329",
    "513130",
    "513090",
    "513120",
    "159206",
    "159218",
    "159227",
    "159565",
    "562500",
    "159819",
    "159363",
    "512480",
    "512760",
    "515880",
    "515230",
    "515050",
    "159786",
    "159890",
    "516160",
    "515790",
    "159755",
    "512660",
    "159732",
    "159992",
    "159852",
    "159851",
    "159869",
    "516780",
    "159928",
    "512690",
    "515170",
    "512010",
    "512980",
    "159378",
    "159611",
    "159766",
    "515220",
    "159865",
    "562800",
    "560860",
    "510050",
    "510300",
    "159922",
    "159531",
    "159915",
    "588080",
    "588380",
    "160211",
    "512000",
    "512800",
    "510880",
    "511090"
  ],
  "benchmark": "000300",
  "start": "2024-09-15",
  "end": "2026-09-15",
  "indicators": {
    "warmup120": {
      "kind": "sma",
      "period": 120
    }
  },
  "entry": true,
  "exit": false,
  "selection": {
    "max_positions": 1,
    "rank_by": "close",
    "descending": true,
    "mode": "rotate"
  },
  "execution": {
    "initial_cash": 100000,
    "commission_rate": 5e-05,
    "min_commission": 5,
    "slippage": 0,
    "lot_size": 100,
    "max_exposure": 0.995
  }
}
