{
  "version": 1,
  "name": "RSI 回落后上穿",
  "universe": [
    "DEMO_EQ",
    "DEMO_GOLD",
    "DEMO_BOND"
  ],
  "benchmark": "DEMO_EQ",
  "start": "2023-05-01",
  "end": "2026-01-23",
  "indicators": {
    "rsi14": {
      "kind": "rsi",
      "period": 14
    },
    "macd_hist": {
      "kind": "macd",
      "fast": 12,
      "slow": 26,
      "signal": 9,
      "output": "hist"
    },
    "sma60": {
      "kind": "sma",
      "period": 60
    },
    "roc21": {
      "kind": "roc",
      "period": 21
    }
  },
  "entry": {
    "all": [
      {
        "left": "rsi14",
        "op": "cross_above",
        "right": 35
      },
      {
        "left": "close",
        "op": "gt",
        "right": "sma60"
      }
    ]
  },
  "exit": {
    "any": [
      {
        "left": "rsi14",
        "op": "gt",
        "right": 70
      },
      {
        "left": "close",
        "op": "lt",
        "right": "sma60"
      }
    ]
  },
  "selection": {
    "max_positions": 2,
    "rank_by": "roc21",
    "descending": true,
    "mode": "hold"
  },
  "execution": {
    "initial_cash": 100000,
    "commission_rate": 0.0003,
    "min_commission": 5,
    "slippage": 0.0005,
    "lot_size": 100,
    "max_exposure": 0.9
  }
}
